{
  "catalog_schema_version": "1.0",
  "questionnaire_name": "Developmental Questionnaire (Toddler Mental Development Survey)",
  "questionnaire_schema_version": "developmental-questionnaire-v3",
  "ml_export_schema_version": "developmental-questionnaire-v3-ml-classification-v1",
  "language": "en",
  "caregiver_instruction": "Please answer according to what your child usually does now. Consider the behaviour in any language regularly used with your child. Do not select 'Yes, usually' for something your child has done only once. Select 'Not observed' when your child has not had a reasonable opportunity to demonstrate the behaviour.",
  "repository_provenance": {
    "source": "Project-owner-supplied questionnaire reference",
    "repository_inclusion_authorized_on": "2026-08-22",
    "authoritative_document_reference": "not supplied",
    "underlying_license_status": "not supplied"
  },
  "response_options": [
    {
      "label": "Yes, usually",
      "code": "YES_USUALLY",
      "numeric_value": 2,
      "scorable": true
    },
    {
      "label": "Sometimes",
      "code": "SOMETIMES",
      "numeric_value": 1,
      "scorable": true
    },
    {
      "label": "Not yet",
      "code": "NOT_YET",
      "numeric_value": 0,
      "scorable": true
    },
    {
      "label": "Not sure",
      "code": "NOT_SURE",
      "numeric_value": null,
      "scorable": false
    },
    {
      "label": "I have not had an opportunity to observe this",
      "code": "NOT_OBSERVED",
      "numeric_value": null,
      "scorable": false
    }
  ],
  "checkpoints": [
    {
      "checkpoint_id": "CP2M",
      "display_age": "2 months",
      "minimum_age_days": 0,
      "maximum_age_days": 91,
      "corrected_age_applies": true
    },
    {
      "checkpoint_id": "CP4M",
      "display_age": "4 months",
      "minimum_age_days": 92,
      "maximum_age_days": 152,
      "corrected_age_applies": true
    },
    {
      "checkpoint_id": "CP6M",
      "display_age": "6 months",
      "minimum_age_days": 153,
      "maximum_age_days": 213,
      "corrected_age_applies": true
    },
    {
      "checkpoint_id": "CP9M",
      "display_age": "9 months",
      "minimum_age_days": 214,
      "maximum_age_days": 304,
      "corrected_age_applies": true
    },
    {
      "checkpoint_id": "CP12M",
      "display_age": "12 months",
      "minimum_age_days": 305,
      "maximum_age_days": 395,
      "corrected_age_applies": true
    },
    {
      "checkpoint_id": "CP15M",
      "display_age": "15 months",
      "minimum_age_days": 396,
      "maximum_age_days": 486,
      "corrected_age_applies": true
    },
    {
      "checkpoint_id": "CP18M",
      "display_age": "18 months",
      "minimum_age_days": 487,
      "maximum_age_days": 639,
      "corrected_age_applies": true
    },
    {
      "checkpoint_id": "CP24M",
      "display_age": "24 months",
      "minimum_age_days": 640,
      "maximum_age_days": 821,
      "corrected_age_applies": true
    },
    {
      "checkpoint_id": "CP30M",
      "display_age": "30 months",
      "minimum_age_days": 822,
      "maximum_age_days": 1004,
      "corrected_age_applies": false
    },
    {
      "checkpoint_id": "CP36M",
      "display_age": "36 months",
      "minimum_age_days": 1005,
      "maximum_age_days": 1278,
      "corrected_age_applies": false
    },
    {
      "checkpoint_id": "CP48M",
      "display_age": "48 months",
      "minimum_age_days": 1279,
      "maximum_age_days": 1643,
      "corrected_age_applies": false
    },
    {
      "checkpoint_id": "CP60M",
      "display_age": "60 months",
      "minimum_age_days": 1644,
      "maximum_age_days": 1826,
      "corrected_age_applies": false
    }
  ],
  "questions": [
    {
      "question_id": "CP2M_COMM_Q1",
      "checkpoint_id": "CP2M",
      "domain": "communication",
      "order": 1,
      "feature_column": "communication_q1",
      "text": "When your child hears the voice of a familiar adult, does your child suddenly become quiet or change their facial expression or movements?"
    },
    {
      "question_id": "CP2M_COMM_Q2",
      "checkpoint_id": "CP2M",
      "domain": "communication",
      "order": 2,
      "feature_column": "communication_q2",
      "text": "Does your child make soft sounds such as cooing, apart from crying?"
    },
    {
      "question_id": "CP2M_COMM_Q3",
      "checkpoint_id": "CP2M",
      "domain": "communication",
      "order": 3,
      "feature_column": "communication_q3",
      "text": "When you speak lovingly to your child, are there times when your child makes a sound in response?"
    },
    {
      "question_id": "CP2M_COMM_Q4",
      "checkpoint_id": "CP2M",
      "domain": "communication",
      "order": 4,
      "feature_column": "communication_q4",
      "text": "When awake and comfortable, does your child begin making sounds on their own before anyone speaks to them?"
    },
    {
      "question_id": "CP2M_COMM_Q5",
      "checkpoint_id": "CP2M",
      "domain": "communication",
      "order": 5,
      "feature_column": "communication_q5",
      "text": "After a familiar adult imitates a sound your child made, does your child make another sound?"
    },
    {
      "question_id": "CP2M_COG_Q1",
      "checkpoint_id": "CP2M",
      "domain": "cognitive",
      "order": 1,
      "feature_column": "cognitive_q1",
      "text": "When an adult is nearby, does your child look at the adult's face, even briefly?"
    },
    {
      "question_id": "CP2M_COG_Q2",
      "checkpoint_id": "CP2M",
      "domain": "cognitive",
      "order": 2,
      "feature_column": "cognitive_q2",
      "text": "When you slowly move your face or a toy from side to side, does your child follow it with their eyes until it moves out of sight?"
    },
    {
      "question_id": "CP2M_COG_Q3",
      "checkpoint_id": "CP2M",
      "domain": "cognitive",
      "order": 3,
      "feature_column": "cognitive_q3",
      "text": "When your child understands that feeding is about to begin—for example, when shown the feeding bottle or picked up—does your child show signs of getting ready to feed?"
    },
    {
      "question_id": "CP2M_COG_Q4",
      "checkpoint_id": "CP2M",
      "domain": "cognitive",
      "order": 4,
      "feature_column": "cognitive_q4",
      "text": "When two nearby faces or two toys are visible, does your child look at one and then shift their gaze to the other?"
    },
    {
      "question_id": "CP2M_COG_Q5",
      "checkpoint_id": "CP2M",
      "domain": "cognitive",
      "order": 5,
      "feature_column": "cognitive_q5",
      "text": "After seeing the same simple picture or age-appropriate toy several times, does your child show renewed interest when a different one appears?"
    },
    {
      "question_id": "CP2M_SOC_Q1",
      "checkpoint_id": "CP2M",
      "domain": "social_emotional",
      "order": 1,
      "feature_column": "social_emotional_q1",
      "text": "Does your child smile when an adult smiles or speaks lovingly to them?"
    },
    {
      "question_id": "CP2M_SOC_Q2",
      "checkpoint_id": "CP2M",
      "domain": "social_emotional",
      "order": 2,
      "feature_column": "social_emotional_q2",
      "text": "Does your child calm down when held, touched, or comforted by a familiar adult?"
    },
    {
      "question_id": "CP2M_SOC_Q3",
      "checkpoint_id": "CP2M",
      "domain": "social_emotional",
      "order": 3,
      "feature_column": "social_emotional_q3",
      "text": "During quiet face-to-face moments, does your child look at a familiar adult?"
    },
    {
      "question_id": "CP2M_SOC_Q4",
      "checkpoint_id": "CP2M",
      "domain": "social_emotional",
      "order": 4,
      "feature_column": "social_emotional_q4",
      "text": "For example, while being changed or bathed, does your child remain calm and alert rather than becoming unsettled?"
    },
    {
      "question_id": "CP2M_SOC_Q5",
      "checkpoint_id": "CP2M",
      "domain": "social_emotional",
      "order": 5,
      "feature_column": "social_emotional_q5",
      "text": "When your child needs a break, do they show it by looking away, becoming quiet, or becoming unsettled?"
    },
    {
      "question_id": "CP4M_COMM_Q1",
      "checkpoint_id": "CP4M",
      "domain": "communication",
      "order": 1,
      "feature_column": "communication_q1",
      "text": "When someone speaks, does your child turn their eyes, head, or attention towards that person?"
    },
    {
      "question_id": "CP4M_COMM_Q2",
      "checkpoint_id": "CP4M",
      "domain": "communication",
      "order": 2,
      "feature_column": "communication_q2",
      "text": "Does your child make different sounds to express happiness, interest, or discomfort?"
    },
    {
      "question_id": "CP4M_COMM_Q3",
      "checkpoint_id": "CP4M",
      "domain": "communication",
      "order": 3,
      "feature_column": "communication_q3",
      "text": "During face-to-face communication, does your child make a sound in response after an adult speaks and pauses?"
    },
    {
      "question_id": "CP4M_COMM_Q4",
      "checkpoint_id": "CP4M",
      "domain": "communication",
      "order": 4,
      "feature_column": "communication_q4",
      "text": "When making sounds, does your child repeatedly make clear vowel-like sounds such as \"oo,\" \"ah,\" or \"ee\"?"
    },
    {
      "question_id": "CP4M_COMM_Q5",
      "checkpoint_id": "CP4M",
      "domain": "communication",
      "order": 5,
      "feature_column": "communication_q5",
      "text": "While your child is making sounds, do they stop as if listening when an adult begins to speak?"
    },
    {
      "question_id": "CP4M_COG_Q1",
      "checkpoint_id": "CP4M",
      "domain": "cognitive",
      "order": 1,
      "feature_column": "cognitive_q1",
      "text": "Does your child look at an interesting person or object for several seconds?"
    },
    {
      "question_id": "CP4M_COG_Q2",
      "checkpoint_id": "CP4M",
      "domain": "cognitive",